{
  "id": "nelson_mandela",
  "entity_type": "Person",
  "labels": [
    "Nelson Mandela",
    "Nelson Rolihlahla Mandela"
  ],
  "summary_variants": {
    "short_answer": "Nelson Mandela was a South African anti-apartheid leader who became the country's first democratically elected president in 1994.",
    "kid_friendly": "Nelson Mandela worked for fairness in South Africa. After many years in prison, he helped bring peace and became president.",
    "standard": "Nelson Mandela (1918–2013) was a South African lawyer, anti-apartheid organizer, and the first Black president of South Africa. After serving 27 years in prison for his activism, he negotiated the end of apartheid and led a government focused on reconciliation and institution building from 1994 to 1999.",
    "expert_notes": "Mention the Rivonia Trial, Robben Island imprisonment, negotiations with F.W. de Klerk, the Truth and Reconciliation Commission, and long-term regional diplomacy."
  },
  "slots": {
    "full_name": "Nelson Rolihlahla Mandela",
    "date_of_birth": "1918-07-18",
    "place_of_birth": "Mvezo, Cape Province, South Africa",
    "date_of_death": "2013-12-05",
    "nationalities": ["South African"],
    "occupations": ["lawyer", "politician", "activist"],
    "roles_offices": [
      "President of South Africa (1994–1999)",
      "President of the African National Congress (1991–1997)"
    ],
    "notable_actions": [
      "Led the African National Congress's armed wing Umkhonto we Sizwe",
      "Negotiated the end of apartheid with the National Party government",
      "Helped establish the Truth and Reconciliation Commission"
    ],
    "awards": [
      "Nobel Peace Prize (1993)",
      "US Presidential Medal of Freedom (2002)"
    ],
    "education": [
      "University of Fort Hare",
      "University of the Witwatersrand"
    ],
    "current_status": "Deceased (2013)"
  },
  "evidence": [
    {
      "source_id": "wp_nelson_mandela",
      "type": "reference_article",
      "title": "Nelson Mandela",
      "year": 2024,
      "venue": "Wikipedia",
      "url": "https://en.wikipedia.org/wiki/Nelson_Mandela",
      "supports_claims": [
        "/slots/roles_offices",
        "/slots/notable_actions"
      ],
      "notes": "Historical overview."
    }
  ],
  "consensus_level": "consensus_high",
  "epistemic_type": "empirical_historical",
  "relations": [],
  "meta": {
    "schema_version": "0.1",
    "created_at": "2024-01-01T00:00:00Z",
    "last_reviewed": "2024-01-15T00:00:00Z",
    "reviewed_by": [
      "editor_team"
    ],
    "sources": [
      {
        "type": "reference_article",
        "title": "Nelson Mandela - Nobel Prize",
        "url": "https://www.nobelprize.org/prizes/peace/1993/mandela/biographical/",
        "note": "Nobel Prize biography."
      }
    ],
    "notes": ""
  }
}

