{
  "id": "warsaw_poland",
  "entity_type": "Place",
  "labels": [
    "Warsaw",
    "Warsaw, Poland"
  ],
  "summary_variants": {
    "short_answer": "Warsaw is the capital and largest city of Poland, rebuilt after World War II into a political, cultural, and economic center.",
    "kid_friendly": "Warsaw is Poland's biggest city. It has colorful buildings, museums, and parks that were rebuilt after the war.",
    "standard": "Warsaw sits on the Vistula River in east-central Poland. It houses the national government, thriving finance and tech sectors, major universities, and a UNESCO-listed Old Town reconstructed after heavy wartime destruction.",
    "expert_notes": "Mention post-war socialist realist planning, modern skyline growth, and role in EU/NATO diplomacy."
  },
  "slots": {
    "place_type": "city",
    "country": "Poland",
    "region": "Masovian Voivodeship",
    "coordinates": {
      "lat": 52.2297,
      "lon": 21.0122
    },
    "population_estimate": 1790000,
    "founded_or_incorporated": "1323 (city rights); capital since 1596",
    "notable_features": [
      "Capital of Poland",
      "Reconstructed UNESCO Old Town",
      "Major Central European financial and tech hub"
    ],
    "economic_roles": [
      "Government administration",
      "Finance and insurance",
      "Technology and research"
    ]
  },
  "evidence": [
    {
      "source_id": "wp_warsaw",
      "type": "reference_article",
      "title": "Warsaw",
      "year": 2024,
      "venue": "Wikipedia",
      "url": "https://en.wikipedia.org/wiki/Warsaw",
      "supports_claims": [
        "/slots/notable_features"
      ],
      "notes": "City overview."
    }
  ],
  "consensus_level": "consensus_high",
  "epistemic_type": "empirical_historical",
  "relations": [],
  "meta": {
    "schema_version": "0.1",
    "created_at": "2024-01-01T00:00:00Z",
    "last_reviewed": "2024-01-15T00:00:00Z",
    "reviewed_by": [
      "editor_team"
    ],
    "sources": [
      {
        "type": "reference_article",
        "title": "City of Warsaw Data",
        "url": "https://um.warszawa.pl/en",
        "note": "Municipal portal."
      }
    ],
    "notes": ""
  }
}

