{
  "id": "barack_obama",
  "entity_type": "Person",
  "labels": [
    "Barack Obama",
    "Barack Hussein Obama II",
    "President Obama"
  ],
  "summary_variants": {
    "short_answer": "Barack Obama is an American politician and author who served as the 44th President of the United States from 2009 to 2017.",
    "kid_friendly": "Barack Obama was the leader of the United States for eight years and worked on rules about health care, the economy, and the environment.",
    "standard": "Barack Obama is an American politician, lawyer, and author who represented Illinois in the U.S. Senate before serving two terms as the 44th President of the United States (2009–2017). His administration focused on economic recovery, health-care reform, climate agreements, and expanded diplomacy.",
    "expert_notes": "Highlight the Affordable Care Act, response to the Great Recession, bin Laden operation, Iran nuclear negotiations, and long-term impacts on party coalitions."
  },
  "slots": {
    "full_name": "Barack Hussein Obama II",
    "date_of_birth": "1961-08-04",
    "place_of_birth": "Honolulu, Hawaii, United States",
    "nationalities": ["American"],
    "occupations": ["politician", "lawyer", "author"],
    "roles_offices": [
      "44th President of the United States (2009–2017)",
      "U.S. Senator from Illinois (2005–2008)",
      "Illinois State Senator (1997–2004)"
    ],
    "notable_actions": [
      "Signed the Affordable Care Act (2010)",
      "Oversaw the operation that killed Osama bin Laden (2011)",
      "Negotiated the Paris Agreement on climate (2015)",
      "Supported economic stimulus and auto-industry rescue (2009)"
    ],
    "awards": ["Nobel Peace Prize (2009)"],
    "education": [
      "Columbia University (BA)",
      "Harvard Law School (JD)"
    ],
    "current_status": "Living"
  },
  "evidence": [
    {
      "source_id": "wp_barack_obama",
      "type": "reference_article",
      "title": "Barack Obama",
      "year": 2024,
      "venue": "Wikipedia",
      "url": "https://en.wikipedia.org/wiki/Barack_Obama",
      "supports_claims": [
        "/slots/date_of_birth",
        "/slots/place_of_birth",
        "/slots/roles_offices"
      ],
      "notes": "General biographical summary."
    }
  ],
  "consensus_level": "consensus_high",
  "epistemic_type": "empirical_historical",
  "relations": [
    {
      "type": "born_in",
      "target_id": "honolulu_hawaii",
      "description": "Born in Honolulu."
    }
  ],
  "meta": {
    "schema_version": "0.1",
    "created_at": "2024-01-01T00:00:00Z",
    "last_reviewed": "2024-01-15T00:00:00Z",
    "reviewed_by": [
      "editor_team"
    ],
    "sources": [
      {
        "type": "reference_article",
        "title": "Barack Obama - Biography",
        "url": "https://www.whitehouse.gov/about-the-white-house/presidents/barack-obama/",
        "note": "White House historical summary."
      }
    ],
    "notes": ""
  }
}

